{"content_hash":"sha256:aaaaaaaaaaaaaaaaaaaaaaaaaaaaaaaaaaaaaaaaaaaaaaaaaaaaaaaaaaaaaaaa","created_at":"2026-08-05T00:00:00Z","facets":["authored","traceability"],"fields":[{"path":"/statement","value":"The client shall reconnect after an unexpected disconnect."}],"fragments":[],"human_key":"REQ-SW-0001","kind":"software_requirement","object_uid":"018f0000-0000-7000-8000-000000000001","parent_revision_uid":null,"provenance_origin":"authored","resource_type":"revision","revision_number":1,"revision_uid":"018f0000-0000-7000-8000-000000000002","schema_version":"1.0"}
